{
  "authority": {
    "cpu_seconds": 75.380631,
    "peak_rss_bytes": 819924992,
    "pressure_cpu_seconds": 0.095576,
    "pressure_io_seconds": 4.143445,
    "pressure_memory_seconds": 0.0,
    "read_bytes": 50825854976,
    "wall_seconds": 84.46230795898009,
    "write_bytes": 16199081984
  },
  "disagreements": [],
  "exit_code": 0,
  "graphforge": {
    "failed_phase": null,
    "phases": [
      {
        "duration_ms": 10,
        "exit_code": 0,
        "peak_rss_bytes": 126976,
        "phase": "admission",
        "status": "passed"
      },
      {
        "duration_ms": 1603,
        "exit_code": 0,
        "peak_rss_bytes": 73072640,
        "phase": "generate",
        "status": "passed"
      },
      {
        "duration_ms": 49027,
        "exit_code": 0,
        "peak_rss_bytes": 132149248,
        "phase": "ingest",
        "receipts": [
          {
            "contract": "graphforge-import-session/1",
            "outcome": "begun"
          },
          {
            "contract": "graphforge-import-session/1",
            "outcome": "registered"
          },
          {
            "contract": "graphforge-import-session/1",
            "outcome": "registered"
          },
          {
            "bytes_accepted": 205584915,
            "construction": {
              "accepted_chunks": 68,
              "application_io": {
                "phases": {
                  "append_merge": {
                    "block_count": 0,
                    "fsync_calls": 0,
                    "object_count": 68,
                    "read_bytes": 0,
                    "read_calls": 0,
                    "write_bytes": 781593496,
                    "write_calls": 2004
                  },
                  "cas_install_read_write": {
                    "block_count": 0,
                    "fsync_calls": 0,
                    "object_count": 0,
                    "read_bytes": 0,
                    "read_calls": 0,
                    "write_bytes": 0,
                    "write_calls": 0
                  },
                  "encode_write_postwrite_authentication": {
                    "block_count": 0,
                    "fsync_calls": 188,
                    "object_count": 0,
                    "read_bytes": 1442843347,
                    "read_calls": 41218,
                    "write_bytes": 368025637,
                    "write_calls": 9780
                  },
                  "fsync_synchronization": {
                    "block_count": 0,
                    "fsync_calls": 2554,
                    "object_count": 0,
                    "read_bytes": 0,
                    "read_calls": 0,
                    "write_bytes": 0,
                    "write_calls": 0
                  },
                  "hydration_verification": {
                    "block_count": 0,
                    "fsync_calls": 0,
                    "object_count": 0,
                    "read_bytes": 0,
                    "read_calls": 0,
                    "write_bytes": 0,
                    "write_calls": 0
                  },
                  "publication_preauthentication": {
                    "block_count": 0,
                    "fsync_calls": 0,
                    "object_count": 0,
                    "read_bytes": 0,
                    "read_calls": 0,
                    "write_bytes": 0,
                    "write_calls": 0
                  },
                  "recovery_reauthentication": {
                    "block_count": 0,
                    "fsync_calls": 0,
                    "object_count": 0,
                    "read_bytes": 3220945801,
                    "read_calls": 3267,
                    "write_bytes": 0,
                    "write_calls": 0
                  },
                  "seal_authentication": {
                    "block_count": 0,
                    "fsync_calls": 0,
                    "object_count": 0,
                    "read_bytes": 0,
                    "read_calls": 0,
                    "write_bytes": 0,
                    "write_calls": 0
                  },
                  "shape_consume_reauthentication": {
                    "block_count": 6120,
                    "fsync_calls": 0,
                    "object_count": 0,
                    "read_bytes": 4024521536,
                    "read_calls": 67878,
                    "write_bytes": 3007963183,
                    "write_calls": 3625
                  }
                },
                "totals": {
                  "block_count": 6120,
                  "fsync_calls": 2742,
                  "object_count": 68,
                  "read_bytes": 8688310684,
                  "read_calls": 112363,
                  "write_bytes": 4157582316,
                  "write_calls": 15409
                }
              },
              "cache_release_operations": 10354,
              "cache_release_unsupported_operations": 0,
              "cache_released_bytes": 16001125874,
              "configured_batch_rows": 65536,
              "construction_staging": {
                "allocated_bytes": 162582528,
                "logical_bytes": 162440730,
                "logical_references": 84,
                "physical_logical_bytes": 162440730,
                "physical_objects": 84
              },
              "construction_staging_transient_peak_allocated_bytes": 1880453120,
              "fsync_operations": 872,
              "immutable_artifacts": 268,
              "input_batches": 68,
              "input_rows": 4456448,
              "peak_batch_bytes": 3670536,
              "peak_batch_rows": 65536,
              "peak_cache_release_window_bytes": 67108864,
              "publication_committed": false,
              "publication_work": {
                "cas_install_read_write": {
                  "block_count": 0,
                  "fsync_calls": 0,
                  "object_count": 0,
                  "read_bytes": 0,
                  "read_calls": 0,
                  "write_bytes": 0,
                  "write_calls": 0
                },
                "contract": "graphforge-publication-work/1",
                "encode_write_postwrite_authentication": {
                  "block_count": 0,
                  "fsync_calls": 188,
                  "object_count": 0,
                  "read_bytes": 1442843347,
                  "read_calls": 41218,
                  "write_bytes": 368025637,
                  "write_calls": 9780
                },
                "fsync_synchronization": {
                  "block_count": 0,
                  "fsync_calls": 2554,
                  "object_count": 0,
                  "read_bytes": 0,
                  "read_calls": 0,
                  "write_bytes": 0,
                  "write_calls": 0
                },
                "hydration_verification": {
                  "block_count": 0,
                  "fsync_calls": 0,
                  "object_count": 0,
                  "read_bytes": 0,
                  "read_calls": 0,
                  "write_bytes": 0,
                  "write_calls": 0
                },
                "publication_preauthentication": {
                  "block_count": 0,
                  "fsync_calls": 0,
                  "object_count": 0,
                  "read_bytes": 0,
                  "read_calls": 0,
                  "write_bytes": 0,
                  "write_calls": 0
                },
                "semantic_total_operations": 53740
              },
              "transient_peak_allocated_bytes": 1880453120,
              "write_bytes": 781593496,
              "write_operations": 2004
            },
            "contract": "graphforge-import-session/1",
            "operation_timings": {
              "append": {
                "calls": 68,
                "elapsed_ns": 4157753394,
                "errors": 0
              },
              "begin": {
                "calls": 1,
                "elapsed_ns": 931668,
                "errors": 0
              },
              "publish": {
                "calls": 0,
                "elapsed_ns": 0,
                "errors": 0
              },
              "resume": {
                "calls": 0,
                "elapsed_ns": 0,
                "errors": 0
              },
              "seal": {
                "calls": 1,
                "elapsed_ns": 37287859327,
                "errors": 0
              }
            },
            "outcome": "validated",
            "rows_accepted": 4456448,
            "rows_rejected": 0
          },
          {
            "construction": {
              "accepted_chunks": 68,
              "application_io": {
                "phases": {
                  "append_merge": {
                    "block_count": 0,
                    "fsync_calls": 0,
                    "object_count": 68,
                    "read_bytes": 0,
                    "read_calls": 0,
                    "write_bytes": 781593496,
                    "write_calls": 2004
                  },
                  "cas_install_read_write": {
                    "block_count": 0,
                    "fsync_calls": 791,
                    "object_count": 0,
                    "read_bytes": 162782947,
                    "read_calls": 2824,
                    "write_bytes": 162625988,
                    "write_calls": 2674
                  },
                  "encode_write_postwrite_authentication": {
                    "block_count": 0,
                    "fsync_calls": 188,
                    "object_count": 0,
                    "read_bytes": 1442843347,
                    "read_calls": 41218,
                    "write_bytes": 368025637,
                    "write_calls": 9780
                  },
                  "fsync_synchronization": {
                    "block_count": 0,
                    "fsync_calls": 2566,
                    "object_count": 0,
                    "read_bytes": 0,